{
    "cnpjIF": "99999999",
    "dataHoraRemessa": "2023-12-12 10:00:00",
    "database": "2023-12",
    "operacoes": [
        {
            "acao": 1,
            "ipoc": "876543210216210020716C1234",
            "saldoDevedor": 5000.00,
            "atraso": "N",
            "pagamentos": [
                {
                    "acao": 1,
                    "data": "2023-12-11",
                    "class3050": "110221101",
                    "valor": 1000.00
                }
            ]
        },
        {
            "acao": 1,
            "ipoc": "876543210216210020716C1235",
            "saldoDevedor": 2000.00,
            "atraso": "N",
            "pagamentos": [
                {
                    "acao": 1,
                    "data": "2023-12-10",
                    "class3050": "110221101",
                    "valor": 1000.00
                },
                {
                    "acao": 1,
                    "data": "2023-12-13",
                    "class3050": "110221101",
                    "valor": 1000.00
                }
            ]
        },
        {
            "acao": 1,
            "ipoc": "876543210216210020716C1236",
            "saldoDevedor": 15000.00,
            "atraso": "N",
            "concessoes": [
                {
                    "acao": 1,
                    "data": "2023-12-11",
                    "class3050": "110221101",
                    "valor": 15000.00
                }
            ]
        },
        {
            "acao": 1,
            "ipoc": "876543210216210020716C1237",
            "saldoDevedor": 30000.00,
            "atraso": "N",
            "concessoes": [
                {
                    "acao": 1,
                    "data": "2023-12-07",
                    "class3050": "110221101",
                    "valor": 32000.00
                }
            ],
            "pagamentos": [
                {
                    "acao": 1,
                    "data": "2023-12-14",
                    "class3050": "110221101",
                    "valor": 2000.00
                }
            ]
        }
    ],
    "pagAgregados": [
        {
            "acao": 1,
            "data": "2023-12-11",
            "class3050": "110216204",
            "valor": 20000.00
        },
        {
            "acao": 1,
            "data": "2023-12-12",
            "class3050": "110216204",
            "valor": 30000.00
        },
        {
            "acao": 2,
            "data": "2023-12-12",
            "class3050": "110216204",
            "valor": 30000.00
        }
    ]
}